<?xml version="1.0" encoding="UTF-8"?>

<!DOCTYPE network SYSTEM "file:C:\\MarketXS\cvs\network-management\src\configuration\configuration.dtd">


<!--
    Document   : XMLDocument.xml
    Created on : 30 September 2003, 14:21
    Author     : Laurence Crutcher
    Description:
        Purpose of the document follows.
-->

<network>

<router>
<routerId>1</routerId>
<administration>

<host>localhost</host>
<managementPort>1095</managementPort>
<httpUser>administrator</httpUser>
<httpPassword>secret</httpPassword>
<httpPort>8082</httpPort>
<listenerPort>5050</listenerPort>
<managementKey>
<managementDomain>Test</managementDomain>
<managementAgent>testagent</managementAgent>
</managementKey>
</administration>

<interface>
<address>
<addressElement>1</addressElement>
<addressElement>2</addressElement>
</address>
<metric>
1
</metric>
</interface>

<interface>
<address>
<addressElement>1</addressElement>
<addressElement>1</addressElement>
</address>
<metric>
1
</metric>
</interface>
</router>

<router>
<routerId>2</routerId>
<administration>

<host>localhost</host>
<managementPort>1099</managementPort>
<httpUser>administrator</httpUser>
<httpPassword>secret</httpPassword>
<httpPort>8082</httpPort>
<listenerPort>5050</listenerPort>
<managementKey>
<managementDomain>Test</managementDomain>
<managementAgent>testagent</managementAgent>
</managementKey>
</administration>

<interface>
<address>
<addressElement>2</addressElement>
<addressElement>1</addressElement>
</address>
<metric>
2
</metric>
</interface>
</router>

<connection>
<source>
<routerId>
1
</routerId>
<address>
<addressElement>1</addressElement>
<addressElement>2</addressElement>
</address>
</source>

<destination>
<routerId>
2
</routerId>
<address>
<addressElement>2</addressElement>
<addressElement>1</addressElement>
</address>
</destination>

<distance>
1
</distance>
</connection>

</network>


